{"artifacts":[{"arch":"arm64","entrypoint":"agent-collab-runtime","files":[{"architecture":"arm64","install_mode":320,"macho_type":"bundle","minimum_macos":"14.0","path":"_blake2.so","role":"runtime_library","sha256":"0f0e9960d1c467c4d20693fb5988ee533a2f27f400510981e590efbbbad68618","signing_profile":"production_developer_id","size":89456},{"architecture":"arm64","install_mode":320,"macho_type":"bundle","minimum_macos":"14.0","path":"_bz2.so","role":"runtime_library","sha256":"06432d60b4db75637183dc3d5ecc2f41c0741ff367267051a548666a286c5f51","signing_profile":"production_developer_id","size":72784},{"architecture":"arm64","install_mode":320,"macho_type":"bundle","minimum_macos":"14.0","path":"_codecs_cn.so","role":"runtime_library","sha256":"a1148c393bb19b3abc8ef75802ea329dc65a08bdd5421ca9066d2cbddb31cd05","signing_profile":"production_developer_id","size":185264},{"architecture":"arm64","install_mode":320,"macho_type":"bundle","minimum_macos":"14.0","path":"_codecs_hk.so","role":"runtime_library","sha256":"7f4408d2ffe1e5181f27b90f0ed9b3c37387984f535b57904fd79b553bcd9b0c","signing_profile":"production_developer_id","size":185328},{"architecture":"arm64","install_mode":320,"macho_type":"bundle","minimum_macos":"14.0","path":"_codecs_iso2022.so","role":"runtime_library","sha256":"e56ae6f6de281c3c9323fee4b64e8e0be2b9b0cc4de1a91f57ea1ab6c4fa737d","signing_profile":"production_developer_id","size":71936},{"architecture":"arm64","install_mode":320,"macho_type":"bundle","minimum_macos":"14.0","path":"_codecs_jp.so","role":"runtime_library","sha256":"c2015d2cbdd6e5fa1254c3b7a1dd1865ac303571726a659d7d7d37d60359f0af","signing_profile":"production_developer_id","size":301120},{"architecture":"arm64","install_mode":320,"macho_type":"bundle","minimum_macos":"14.0","path":"_codecs_kr.so","role":"runtime_library","sha256":"d8c478d97b851d5bcb0f739833504aced1ab40e1fe4346c9f827734b08fba152","signing_profile":"production_developer_id","size":168928},{"architecture":"arm64","install_mode":320,"macho_type":"bundle","minimum_macos":"14.0","path":"_codecs_tw.so","role":"runtime_library","sha256":"78c4e1d28f9fffd945f16e78e210a821092f76a0f2e9bd6370674c7da98f51c3","signing_profile":"production_developer_id","size":168432},{"architecture":"arm64","install_mode":320,"macho_type":"bundle","minimum_macos":"14.0","path":"_contextvars.so","role":"runtime_library","sha256":"2337046c8eb0ea8ef3b2eedbc85c8e96f2ce3f33ae827ab5ee15cdcc2326fdb7","signing_profile":"production_developer_id","size":68576},{"architecture":"arm64","install_mode":320,"macho_type":"bundle","minimum_macos":"14.0","path":"_ctypes.so","role":"runtime_library","sha256":"3a0de1fb273e57f8cbc172d0454a8615e54d09b4a80ae3c386b3183a3413ecb0","signing_profile":"production_developer_id","size":175840},{"architecture":"arm64","install_mode":320,"macho_type":"bundle","minimum_macos":"14.0","path":"_datetime.so","role":"runtime_library","sha256":"e9a7dca389b1cfc1ee12fbf31d71f6bf57f8f179e204fc5c3ad549d207be1b45","signing_profile":"production_developer_id","size":150144},{"architecture":"arm64","install_mode":320,"macho_type":"bundle","minimum_macos":"14.0","path":"_decimal.so","role":"runtime_library","sha256":"2e77b431e8edeb38fa9d04262bdb8f45d5e14584a19b156cb74749bb2fd47bac","signing_profile":"production_developer_id","size":364640},{"architecture":"arm64","install_mode":320,"macho_type":"bundle","minimum_macos":"14.0","path":"_heapq.so","role":"runtime_library","sha256":"b79583604a7f31eece020ccd5cee24303eb834a6c10607063ed42459cc85d8e0","signing_profile":"production_developer_id","size":69728},{"architecture":"arm64","install_mode":320,"macho_type":"bundle","minimum_macos":"14.0","path":"_lzma.so","role":"runtime_library","sha256":"f5dbc96467a1e1e51aadda6b2fe1534690c124aea6a868bc689b5c4cd0ef7f97","signing_profile":"production_developer_id","size":92240},{"architecture":"arm64","install_mode":320,"macho_type":"bundle","minimum_macos":"14.0","path":"_md5.so","role":"runtime_library","sha256":"2ff8b756851ae004a6c569756be4afebf67675bcf9d6c1c19534d952ea7b3135","signing_profile":"production_developer_id","size":71728},{"architecture":"arm64","install_mode":320,"macho_type":"bundle","minimum_macos":"14.0","path":"_multibytecodec.so","role":"runtime_library","sha256":"a51a095004dbfda8c21cb4aa5ab1c8e570eb043070ed7b7aef48e40d6571cb02","signing_profile":"production_developer_id","size":95808},{"architecture":"arm64","install_mode":320,"macho_type":"bundle","minimum_macos":"14.0","path":"_multiprocessing.so","role":"runtime_library","sha256":"1b3c206e0672337f5430825ca8cac26e6521dc25892dbef9e228dd98b8a50a7d","signing_profile":"production_developer_id","size":73472},{"architecture":"arm64","install_mode":320,"macho_type":"bundle","minimum_macos":"14.0","path":"_opcode.so","role":"runtime_library","sha256":"2d4dd6f5af74704074e56879dd9c2063029d95292833d851c0ec22eee6e37653","signing_profile":"production_developer_id","size":72448},{"architecture":"arm64","install_mode":320,"macho_type":"bundle","minimum_macos":"14.0","path":"_pickle.so","role":"runtime_library","sha256":"3cf56685b1ea252a82a9fcc31dcfa0e59e8d7d780390cb4a27c6b573d46b3913","signing_profile":"production_developer_id","size":168032},{"architecture":"arm64","install_mode":320,"macho_type":"bundle","minimum_macos":"14.0","path":"_posixshmem.so","role":"runtime_library","sha256":"c51f3b5e028abee6eacf44aec04033a2da70a9c53dc260dc0a87f2422196d120","signing_profile":"production_developer_id","size":69408},{"architecture":"arm64","install_mode":320,"macho_type":"bundle","minimum_macos":"14.0","path":"_posixsubprocess.so","role":"runtime_library","sha256":"6f1515541f75a0135dc66f6a986558589db31769d45df3d49d81f324e8f37159","signing_profile":"production_developer_id","size":72496},{"architecture":"arm64","install_mode":320,"macho_type":"bundle","minimum_macos":"14.0","path":"_queue.so","role":"runtime_library","sha256":"e3b972c0ef54b4a447119204b61a7daa3b051699e56876d8e7b6cff1d3bf0064","signing_profile":"production_developer_id","size":71840},{"architecture":"arm64","install_mode":320,"macho_type":"bundle","minimum_macos":"14.0","path":"_random.so","role":"runtime_library","sha256":"42ecc9e65c4f2969508caa5f5fe0f65c924021c6b4bb2cb1ab52b6f17539489c","signing_profile":"production_developer_id","size":71680},{"architecture":"arm64","install_mode":320,"macho_type":"bundle","minimum_macos":"14.0","path":"_scproxy.so","role":"runtime_library","sha256":"f2b6035bed3231c4d477369afcc1182b30f9d14656cc51b52a88f3dd9475a5a1","signing_profile":"production_developer_id","size":71232},{"architecture":"arm64","install_mode":320,"macho_type":"bundle","minimum_macos":"14.0","path":"_sha1.so","role":"runtime_library","sha256":"dfa7e9c49b8ba7d195ff9def4646dd5d839ea9cd2d35d8d5bb3a1685066e96b3","signing_profile":"production_developer_id","size":71760},{"architecture":"arm64","install_mode":320,"macho_type":"bundle","minimum_macos":"14.0","path":"_sha2.so","role":"runtime_library","sha256":"c70abc7871bacc2cd41483ca1dc4654aa4c939062165a0b9b87e237f3bbc1509","signing_profile":"production_developer_id","size":107264},{"architecture":"arm64","install_mode":320,"macho_type":"bundle","minimum_macos":"14.0","path":"_sha3.so","role":"runtime_library","sha256":"e29eedabb8c2a7b2f66857141019075c38abb210fe53e5d4233e50c8a6616024","signing_profile":"production_developer_id","size":91008},{"architecture":"arm64","install_mode":320,"macho_type":"bundle","minimum_macos":"14.0","path":"_socket.so","role":"runtime_library","sha256":"b791fa94f0c303bfac86ce3298669ecb0b777aebe51bca36cdca003fe68a6c0c","signing_profile":"production_developer_id","size":132288},{"architecture":"arm64","install_mode":320,"macho_type":"bundle","minimum_macos":"14.0","path":"_sqlite3.so","role":"runtime_library","sha256":"8ac1e5dca49c9d39a22417e911ada6d896c122029f7392b174a3ddb93a3e67c4","signing_profile":"production_developer_id","size":161264},{"architecture":"arm64","install_mode":320,"macho_type":"bundle","minimum_macos":"14.0","path":"_statistics.so","role":"runtime_library","sha256":"11345ae014ce444e3ebd816b880775ce4a46d91e20a0d28fbc44e3591d653b5c","signing_profile":"production_developer_id","size":68704},{"architecture":"arm64","install_mode":320,"macho_type":"bundle","minimum_macos":"14.0","path":"_struct.so","role":"runtime_library","sha256":"e0b6b96872128f0003dce8dcb5b524523c3de8ca2a781df0a588f7aa1d798ca0","signing_profile":"production_developer_id","size":94528},{"architecture":"arm64","install_mode":320,"macho_type":"bundle","minimum_macos":"14.0","path":"_uuid.so","role":"runtime_library","sha256":"ed0ba00b1d991015b0aa512fb60805a96e18e9775551d993601080699fc1399a","signing_profile":"production_developer_id","size":68528},{"architecture":"arm64","install_mode":320,"macho_type":"executable","minimum_macos":"14.0","path":"agent-collab-runtime","role":"entrypoint","sha256":"54058e3330ceef4073aed9018c19dc7d24449a46ece4f287b3957daececc20a9","signing_profile":"production_developer_id","size":9195248},{"architecture":"arm64","install_mode":320,"macho_type":"bundle","minimum_macos":"14.0","path":"array.so","role":"runtime_library","sha256":"c6ebbfd0ba9f98e5505d61fcd6fe3b865e1f6c990fb20e7f9b61ae04ceb821d9","signing_profile":"production_developer_id","size":113760},{"architecture":"arm64","install_mode":320,"macho_type":"bundle","minimum_macos":"14.0","path":"binascii.so","role":"runtime_library","sha256":"a90de5b153bbd4fa9ce82b4f0d27eefebe82162ae817ac1c4c89fd107e9727e8","signing_profile":"production_developer_id","size":72224},{"architecture":"arm64","install_mode":320,"macho_type":"bundle","minimum_macos":"14.0","path":"fcntl.so","role":"runtime_library","sha256":"235095395811f4219bf94483f2ef0881aec14d7dd25f580a58f0c8d3f86f236f","signing_profile":"production_developer_id","size":70368},{"architecture":"arm64","install_mode":320,"macho_type":"bundle","minimum_macos":"14.0","path":"grp.so","role":"runtime_library","sha256":"802241d5eee0e44b68979184d8047a25f826be247885b79136a43d21fb5a0096","signing_profile":"production_develope